{
  "pluginId": "beans-corn-squash-iroquois",
  "type": "companion",
  "displayName": "Iroquois Three Sisters (corn + bean + squash polyculture)",
  "version": "1.0.0",
  "pluginSchemaVersion": "1.1",
  "primaryFamily": "corn",
  "goodWith": ["corn-bantam-sweet", "corn-bloody-butcher", "pole-bean-kentucky-wonder", "pole-beans-rattlesnake", "winter-squash-delicata", "butternut-squash-waltham"],
  "badWith": [],
  "benefit": "Traditional Haudenosaunee polyculture. Corn supplies the bean trellis; pole beans fix nitrogen for the next year's corn crop; squash vines shade soil, conserve moisture, and deter raccoons with spiny stems.",
  "members": [
    {
      "family": "legume",
      "role": "nitrogen fixer + trellis climber",
      "plantingOffsetDays": 14,
      "title": "Plant pole beans at corn V3 stage",
      "body": "When corn is 6 to 8 inches tall, plant 4 pole bean seeds around each cornstalk, 4 inches from the stalk."
    },
    {
      "family": "cucurbit",
      "role": "living mulch + animal deterrent",
      "plantingOffsetDays": 28,
      "title": "Plant squash hills at outer rows",
      "body": "Plant winter squash hills 36 inches apart on the outer rows of the corn block. Allow vines to run between corn rows."
    }
  ]
}
